<?xml version="1.0" encoding="iso-8859-1"?>

<!ELEMENT Port (#PCDATA)>
<!ATTLIST Port Number CDATA #REQUIRED>
<!ATTLIST Port Name CDATA #REQUIRED>

<!ELEMENT Ports (Port*)>